Book Id,Title,Author,Author l-f,Additional Authors,ISBN,ISBN13,My Rating,Average Rating,Publisher,Binding,Number of Pages,Year Published,Original Publication Year,Date Read,Date Added,Bookshelves,Bookshelves with positions,Exclusive Shelf,My Review,Spoiler,Private Notes,Read Count,Recommended For,Recommended By,Owned Copies,Original Purchase Date,Original Purchase Location,Condition,Condition Description,BCID
18907382,Coaching for Performance: GROWing Human Potential and Purpose: The Principles and Practice of Coaching and Leadership,John Whitmore,"Whitmore, John",,"=""""","=""""",3,4.10,Nicholas Brealey Publishing,Kindle Edition,241,2010,2002,2015/03/22,2015/02/14,,,read,,,,1,,,0,,,,,
23016056,The Nature of Software Development,Ron Jeffries,"Jeffries, Ron",,"=""""","=""""",4,4.13,Pragmatic Programmers,,,,2015,2015/03/10,2015/03/21,,,read,One of the best little books about software I read in a long time. A perfect flight-time read with nice illustrations. I wish all people involved in software development had similar clarity about what this whole game is about.,,,1,,,0,,,,,
7661631,"Nonviolent Communication: A Language of Life: Create Your Life, Your Relationships, and Your World in Harmony with Your Values",Marshall B. Rosenberg,"Rosenberg, Marshall B.",Arun Gandhi,"=""1892005697""","=""9781892005694""",5,4.34,PuddleDancer Press,ebook,240,2003,1999,2015/02/03,2012/09/29,,,read,"It's a week of reading and a lifetime of practice. An amazing insight into the source of anger, pain and suffering in the world with some humane, compassionate strategies to live in harmony with yourself and the world around you. Sadly Marshall passed away a few days after I have finished reading his legacy. I hope it continues.",,,1,,,1,,,unspecified,,
12150193,"Punished by Rewards: The Trouble with Gold Stars, Incentive Plans, A's, Praise, and Other Bribes",Alfie Kohn,"Kohn, Alfie",,"=""""","=""""",4,4.15,,Kindle Edition,452,,1993,2015/01/25,2014/10/31,,,read,"I loved this book. Perhaps it's not the best written book I've read, there is a fair amount of repetition and some heavy cross-referencing including footnotes on footnotes. I imagine it would've been harder to follow them all in a physical book but it was not a problem with a kindle edition. Regardless it's an amazing book and the content is incredibly stimulating. It has challenged many of my own views on rewards, parenting, management and organisational design. The references are incredibly rich and I'm impressed how much research has gone into this book.",,,1,,,1,,,unspecified,,
10835373,The Psychology of Computer Programming,Gerald M. Weinberg,"Weinberg, Gerald M.",,"=""""","=""2940012212450""",4,4.08,Gerald Weinberg,Nook,292,2011,1971,2015/01/08,2014/11/19,,,read,"Fascinating perspective, a view that is very often missing. Amazing how appropriate and applicable ideas from this book are today! Over 25 years later. I wish more people understood the context of programming form the psychological perspective.",,,1,,,0,,,,,
18241647,Decisive: How to Make Better Decisions,Chip Heath,"Heath, Chip",Dan Heath,"=""1847940862""","=""9781847940865""",3,3.94,Random House Business,Paperback,336,2014,2013,2014/11/12,2014/11/19,,,read,"""Thinking fast and slow"" for beginners. Useful tactics and nice stories.",,,1,,,1,,,unspecified,,
23158207,How Google Works,Eric Schmidt,"Schmidt, Eric",Jonathan Rosenberg,"=""""","=""""",0,4.05,Grand Central Publishing,Kindle Edition,286,2014,2014,,2014/10/31,to-read,to-read (#75),to-read,,,,0,,,0,,,,,
13561217,How to Change the World: Change Management 3.0,Jurgen Appelo,"Appelo, Jurgen",,"=""""","=""""",0,3.95,Jojo Ventures BV,ebook,87,2012,2012,,2014/10/31,,,read,,,,1,,,0,,,,,
18811028,"David and Goliath: Underdogs, Misfits and the Art of Battling Giants",Malcolm Gladwell,"Gladwell, Malcolm",,"=""""","=""""",3,3.96,Penguin,Kindle Edition,293,2013,2013,2014/10/31,2014/10/31,,,read,"Some very interesting stories, some useful ideas. Mostly an entertaining read.",,,1,,,0,,,,,
6564160,"Brain Rules: 12 Principles for Surviving and Thriving at Work, Home, and School",John Medina,"Medina, John",,"=""""","=""""",0,4.01,,Kindle Edition,,,2008,,2014/10/31,to-read,to-read (#74),to-read,,,,0,,,0,,,,,
3828902,Thinking in Systems: A Primer,Donella H. Meadows,"Meadows, Donella H.",Diana       Wright,"=""1603580557""","=""9781603580557""",5,4.21,Chelsea Green Publishing,Paperback,240,2008,2008,2014/10/22,2014/10/13,,,read,"Perhaps it's just a primer, but what a primer! This book has the potential to change your thinking, your world-view, your paradigm. It's a window into a fascinating and important world of systems thinking - one of the best tools I have found so far to start understanding our non-linear, interconnected, complex world.",,,1,,,0,,,,,
15779193,Mindset: How You Can Fulfil Your Potential,Carol S. Dweck,"Dweck, Carol S.",,"=""""","=""""",3,4.07,Robinson,Kindle Edition,246,2012,2006,2014/10/13,2011/12/09,,,read,While trying to explain every aspect of human behaviour in terms of just two mindsets is perhaps slightly too simplistic I really enjoyed reading the book. The mindset approach provides a good reference framework for observing and understanding peoples' actions and approach. There are many interesting examples and very specific advice especially around raising children and teaching young people. There is even some valuable advice for couples.,,,1,,,1,,,unspecified,,
2629179,Understanding Emotion at Work,Stephen Fineman,"Fineman, Stephen",,"=""0761947906""","=""9780761947905""",0,5.00,Sage Publications Ltd,Paperback,204,2003,2003,,2014/08/28,to-read,to-read (#73),to-read,,,,0,,,0,,,,,
29382,Ethics,Peter Singer,"Singer, Peter",,"=""0192892452""","=""9780192892454""",0,3.89,"Oxford University Press, USA",Paperback,432,1994,1994,,2014/08/28,to-read,to-read (#72),to-read,,,,0,,,0,,,,,
9706236,"Management 3.0: Leading Agile Developers, Developing Agile Leaders",Jurgen Appelo,"Appelo, Jurgen",,"=""0321712471""","=""9780321712479""",5,4.14,Addison-Wesley Professional,Paperback,413,2010,2010,2011/01/25,2011/01/10,,,read,,,,1,,,0,,,,,
11500159,The Lean Startup: How Today's Entrepreneurs Use Continuous Innovation to Create Radically Successful Businesses,Eric Ries,"Ries, Eric",,"=""""","=""""",4,4.11,,Kindle Edition,338,2011,2011,,2014/06/14,,,read,,,,1,,,0,,,,,
6278270,The Principles of Product Development Flow: Second Generation Lean Product Development,Donald G. Reinertsen,"Reinertsen, Donald G.",,"=""1935401009""","=""9781935401001""",5,4.17,Celeritas Publishing,Hardcover,294,2009,2009,,2010/01/28,to-read,to-read (#20),to-read,,,,0,,,0,,,,,
865,The Alchemist,Paulo Coelho,"Coelho, Paulo",Alan R. Clarke,"=""0061122416""","=""9780061122415""",3,3.89,HarperCollins,Paperback,197,1993,1988,,2014/06/14,,,read,,,,1,,,0,,,,,
12609433,The Power of Habit: Why We Do What We Do in Life and Business,Charles Duhigg,"Duhigg, Charles",,"=""1400069289""","=""9781400069286""",0,4.12,Random House,Hardcover,375,2012,2012,,2014/06/14,to-read,to-read (#71),to-read,,,,0,,,0,,,,,
826531,Zen and the Art of Motorcycle Maintenance,Robert M. Pirsig,"Pirsig, Robert M.",,"=""0099322617""","=""9780099322610""",4,3.77,Vintage,Paperback,436,1999,1974,2014/06/14,2014/06/02,,,read,"It's an amazing book, only four stars now, there is so much to digest, I'm sure my rating will go up once I understand more. Best modern philosophy book I've read.",,,1,,,0,,,,,
6496947,50 Psychology Ideas You Really Need to Know,Adrian Furnham,"Furnham, Adrian",,"=""1847248527""","=""9781847248527""",2,3.47,Quercus,Hardcover,208,2008,2008,,2014/06/02,,,read,,,,1,,,0,,,,,
13051732,The Upside of Irrationality: The Unexpected Benefits of Defying Logic at Work and at Home,Dan Ariely,"Ariely, Dan",,"=""""","=""""",4,4.03,,Kindle Edition,352,,2010,,2014/06/02,,,read,,,,1,,,0,,,,,
1648693,Software for Your Head: Core Protocols for Creating and Maintaining Shared Vision,Jim McCarthy,"McCarthy, Jim",Michele McCarthy,"=""0201604566""","=""0785342604566""",0,4.02,Addison-Wesley Professional,Paperback,435,2002,2001,,2014/06/02,to-read,to-read (#70),to-read,,,,0,,,0,,,,,
13730648,Penguin's Hidden Talent,Alex Latimer,"Latimer, Alex",,"=""055256267X""","=""9780552562676""",5,3.79,Picture Corgi,Paperback,32,2012,2012,,2014/06/02,,,read,,,,1,,,0,,,,,
781561,Smalltalk Best Practice Patterns,Kent Beck,"Beck, Kent",,"=""013476904X""","=""9780134769042""",5,4.19,Pearson,Paperback,224,1996,1996,2014/03/29,2010/08/15,,,read,Another timeless classic and a great introduction to OO design in any language. SmallTalk is easy enough to read and understand. Fascinating to see how many original ideas from this book have surfaced many times over in Kent's later works.,,,1,,,0,,,,,
16585667,Practical Object-Oriented Design in Ruby: An Agile Primer,Sandi Metz,"Metz, Sandi",,"=""0132930870""","=""9780132930871""",5,4.54,Addison-Wesley Professional,ebook,273,2012,2012,2014/03/03,2014/03/01,,,read,"One of the best books about design I have read. I found it eye-opening especially when it comes to the ""messaging"" view of OO. The fact that all the examples were in Ruby and I don't know Ruby almost at all was a huge benefit for me - I could concentrate on the principles and not on the details.",,,1,,,0,,,,,
3183570,C# in Depth,Jon Skeet,"Skeet, Jon",,"=""1933988363""","=""9781933988368""",4,4.51,Manning Publications,Paperback,424,2008,2008,2010/03/23,2010/03/01,,,read,Simply a must for every C# developer,,Really good,1,,,0,,,,,
762542,The Four Steps to the Epiphany: Successful Strategies for Startups That Win,Steve Blank,"Blank, Steve",,"=""0976470705""","=""9780976470700""",0,3.93,K & S Ranch,Paperback,281,2005,2003,,2013/11/18,to-read,to-read (#69),to-read,,,,0,,,0,,,,,
6828896,"Delivering Happiness: A Path to Profits, Passion, and Purpose",Tony Hsieh,"Hsieh, Tony",,"=""0446563048""","=""9780446563048""",0,4.02,Grand Central Publishing,Hardcover,246,2010,2010,,2013/11/18,to-read,to-read (#68),to-read,,,,0,,,0,,,,,
6707990,Agile Software Development with Scrum. Ken Schwaber and Mike Beedle,Ken Schwaber,"Schwaber, Ken",Mike Beedle,"=""0132074893""","=""9780132074896""",2,3.81,Pearson Prentice Hall,Paperback,158,2008,2001,2012/04/22,2010/03/23,,,read,"Yes, the initial book on Scrum so it's 5/5 for the thinking, the ideas, the change it started. The book itself, is not an easy read, is not very consistent and some of the thinking have now moved on, better to read software in 30 days these days methinks.",,,1,,,1,2010/03/23,,Brand new,,
17255186,"The Phoenix Project: A Novel About IT, DevOps, and Helping Your Business Win",Gene Kim,"Kim, Gene","Kevin Behr, George Spafford","=""0988262592""","=""9780988262591""",4,4.26,IT Revolution Press,Hardcover,345,2013,2013,2013/10/09,2013/10/08,,,read,"OK. So it's not The Goal. The inspiration and the parallels are obvious (even explicit) and the story is entertaining but personally I didn't find it as ground-breaking. It can be very good for people to get a basic understanding of the many concepts (flow, WIP, TOC, systems thinking, ...) The focus of the book is firmly on the operational side of IT and any parallels with software development must be taken with care. ",,,1,,,1,,,Brand new,,
855795,Abolishing Performance Appraisals: Why They Backfire and What to Do Instead,Tom Coens,"Coens, Tom","Mary Jenkins, Peter Block","=""1576752003""","=""9781576752005""",5,3.77,Berrett-Koehler Publishers,Paperback,360,2002,2000,2013/07/31,2012/10/10,,,read,"This has been one of the best books on the topic of people management and failures of the ""traditional organisational management"" that I have come across. This book is grounded in great expertise from people such as Peter Block, Ackoff, Deming... And it's not a straight critique of the existing systems but a deep analysis of the underlying assumptions and how they may be flawed and what could be the alternatives.",,,1,,,1,,,Brand new,,
136181,The Halo Effect: And the Eight Other Business Delusions That Deceive Managers,Philip M. Rosenzweig,"Rosenzweig, Philip M.",,"=""0743291255""","=""9780743291255""",0,3.88,Free Press,Hardcover,232,2007,2007,,2013/06/18,to-read,to-read (#67),to-read,,,,0,,,0,,,,,
227122,Understanding the Linux Kernel,Daniel P. Bovet,"Bovet, Daniel P.",Marco Cesati,"=""0596002130""","=""9780596002138""",0,4.10,O'Reilly Media,Paperback,784,2002,2000,,2010/08/19,to-read,to-read (#36),to-read,,,,0,,,0,,,,,
17910885,Commitment,Olav Maassen,"Maassen, Olav","Chris Matts, Chris Geary","=""9082056909""","=""9789082056907""",0,4.23,Hathaway te Brake Publications,Hardcover,224,2013,2013,,2013/05/15,,,read,,,,1,,,0,,,,,
1069827,Release It!: Design and Deploy Production-Ready Software (Pragmatic Programmers),Michael T. Nygard,"Nygard, Michael T.",,"=""0978739213""","=""9780978739218""",4,4.26,Pragmatic Bookshelf,Paperback,326,2007,2007,2013/04/24,2013/04/13,,,read,"I don't know why I only now got this book in my hands. It reveals so many things that I was missing in my development. It is full of aha! moments and realisations of the things that I have missed with great ideas of how I can improve. The book, in some aspects feels slightly dated - mainly with the technologies mentioned (evident focus on session state and relational databases) yet I can't think of a modern system that takes even a fraction of the applicable advice from the book regardless of technologies. And if you think agile - woven into the fabric of the book are great insights including the OODA loop (way before we had Lean Startup). A must read for every developer.",,,1,,,0,,,,,
44098,The Inmates Are Running the Asylum: Why High Tech Products Drive Us Crazy and How to Restore the Sanity,Alan Cooper,"Cooper, Alan",,"=""0672326140""","=""""",3,3.94,Sams Publishing,Paperback,255,2004,1999,2013/02/20,2012/10/10,,,read,"I have a really hard time rating this one. On the one hand it talks about Goal Driven, User-Centred design which is still deeply neglected and would mark a step change in user interaction and the ease of using our software. On the other hand I can't agree with the over-simplified picture of a software engineer homo logicus that is portrayed in the book. Surely BDUF is not the correct approach even to interaction design. Yet, we can save quite a bit on iterating if we do a decent chunk of it up front.",,,1,,,0,,,,,
21343,The Five Dysfunctions of a Team: A Leadership Fable,Patrick Lencioni,"Lencioni, Patrick",,"=""0787960756""","=""9780787960759""",4,4.08,Jossey-Bass,Hardcover,227,2002,2002,2013/01/22,2010/02/15,,,read,"Great story with fantastic succinct examples. An easy read with very strong and important message and the presented model (or the 5 dysfunctions) are useful for working with teams. Some really good quotes as well, for example how fixing a team is similar to fixing a broken bone.",,,1,,,1,,,Brand new,,
4656126,Predictably Irrational: The Hidden Forces That Shape Our Decisions,Dan Ariely,"Ariely, Dan",,"=""0007256531""","=""9780007256532""",4,4.12,Thorsons/Element GB,Paperback,384,2019,2008,2013/01/11,2010/01/05,,,read,"This book continues the topic of my interest - the psychology, biases and irrational behaviours. It's well written with lots and lots of well referenced and well described studies in behavioural economics. There are some experiments that repeat throughout the literature and some that I read about for the first time. Well worth a read for anyone curious about how and why we behave in many situations (in particular when and why are we honest and what makes us dishonest, how about our relationship to money and how money influences our choices and why two people can have fundamentally different opinion based on exactly the same facts).",,,1,,,0,,,,,
6518085,Pro Git,Scott Chacon,"Chacon, Scott",,"=""1430218339""","=""9781430218333""",3,4.17,Apress,Paperback,290,2009,2009,2012/12/02,2012/11/05,,,read,Read Chapter 9. That's the real thing. Changed how I think about git dramatically.,,,1,,,0,,,,,
714344,Becoming a Technical Leader: An Organic Problem-Solving Approach,Gerald M. Weinberg,"Weinberg, Gerald M.",,"=""0932633021""","=""9780932633026""",5,4.08,"Dorset House Publishing Company, Incorporated",Unknown Binding,284,1986,1986,2012/12/01,2012/10/27,,,read,The best hones advice for aspiring leaders I have ever read. Plus tons of practical exercises.,,,1,,Marc Johnson,1,,,unspecified,,
15746409,Effective Programming: More Than Writing Code,Jeff Atwood,"Atwood, Jeff",,"=""""","=""""",0,3.91,Hyperink,ebook,283,2012,2012,,2012/10/27,to-read,to-read (#66),to-read,,,,0,,,0,,,,,
6145597,Risk: The Science and Politics of Fear,Daniel Gardner,"Gardner, Daniel",,"=""0753515539""","=""9780753515532""",0,3.98,Virgin Books,Paperback,422,2009,2008,,2011/03/21,to-read,to-read (#43),to-read,,,,0,,,0,,,,,
32475,"Dreaming in Code: Two Dozen Programmers, Three Years, 4,732 Bugs, and One Quest for Transcendent Software",Scott Rosenberg,"Rosenberg, Scott",,"=""1400082463""","=""9781400082469""",4,3.71,"Crown Publishing, NY",Hardcover,400,2007,2007,2012/10/26,2012/10/09,,,read,,,,1,,,0,,,,,
10419045,Personal Kanban: Mapping Work | Navigating Life,Jim  Benson,"Benson, Jim",Tonianne DeMaria Barry,"=""1453802266""","=""9781453802267""",4,3.77,Createspace Independent Publishing Platform,Paperback,218,2011,2011,2012/10/16,2012/10/09,,,read,"This is one of the best books I have recently read. Pragmatic, evidence based context sensitive approach to time management for everyone.",,,1,,,0,,,,,
10127019,The Lean Startup: How Today's Entrepreneurs Use Continuous Innovation to Create Radically Successful Businesses,Eric Ries,"Ries, Eric",,"=""0307887898""","=""9780307887894""",0,4.11,Currency,Hardcover,299,2011,2011,,2012/10/10,,,read,,,,1,,,0,,,,,
10311376,Secrets of Consulting: A Guide to Giving and Getting Advice Successfully,Gerald M. Weinberg,"Weinberg, Gerald M.",,"=""""","=""""",0,3.92,,Kindle Edition,228,,1985,,2012/10/10,to-read,to-read (#65),to-read,,,,0,,,0,,,,,
67825,Peopleware: Productive Projects and Teams,Tom DeMarco,"DeMarco, Tom",Timothy R. Lister,"=""0932633439""","=""9780932633439""",5,4.13,"Dorset House Publishing Company, Incorporated",Paperback,245,1999,1987,2009/12/02,2009/11/16,,,read,A very good book - easy read and I was rather surprised that some of the ideas were around for so long. It reads like a very modern and relevant book.<br/><br/>And now that I have read it again in the 2nd edition I like it even more - the final essays nicely expose many dysfunctions of organisations today.,,,2,,,1,,,unspecified,,
13635758,Who Is Agile,Yves Hanoulle,"Hanoulle, Yves","Andrea Chiou, Marcin Floryan, Peter Doomen","=""""","=""""",3,4.14,LeanPub,ebook,370,2012,2012,,2012/08/20,,,read,This is a great book full of interesting personal stories of people who have stumbled across Agile software development and are true practitioners of this approach. ,,,1,,,0,,,,,
12385458,"Thinking, Fast and Slow",Daniel Kahneman,"Kahneman, Daniel",,"=""""","=""""",4,4.17,"Farrar, Straus and Giroux",Kindle Edition,512,2011,2011,2012/08/18,2012/02/09,,,read,,,,1,,,0,,,,,
1523368,Project Retrospectives,Norman L. Kerth,"Kerth, Norman L.",,"=""0932633447""","=""9780932633446""",5,4.18,"Dorset House Publishing Company, Incorporated",Paperback,288,2001,2001,2012/07/13,2012/07/09,,,read,The best book on retrospectives I have ever read. Full of practical exercises and some theoretical grounding with lots of references. This book is much better then the Agile Retrospectives book which now appears to me as a simple rip-off of this book.,,,1,,,0,,,,,
13617626,Kluge: The Haphazard Evolution of the Human Mind,Gary F. Marcus,"Marcus, Gary F.",,"=""0571236529""","=""9780571236527""",4,3.81,Faber and Faber Limited,Paperback,211,2009,2008,2012/05/03,2012/04/26,,,read,A nice journey through the evolutionary changes of our minds and their effects on our current thinking.,,,1,,,0,,,,,
12693642,Lean from the Trenches,Henrik Kniberg,"Kniberg, Henrik",,"=""1934356859""","=""9781934356852""",2,4.22,Pragmatic Bookshelf,Paperback,176,2011,2011,2012/03/04,2012/03/01,,,read,"So it was OK indeed - a very nice story, some interesting insight but it didn't change my world. There is once excellent quote in the book about bugs and I recommend that you pick it up and read it for that one comment. Part 2 might be useful for someone new to Lean or Agile or systems thinking. ",,,1,,,0,,,,,
756250,Organizational Patterns of Agile Software Development,James O. Coplien,"Coplien, James O.",Neil B. Harrison,"=""0131467409""","=""9780131467408""",0,3.85,Pearson,Paperback,432,2004,2004,,2012/02/09,to-read,to-read (#64),to-read,,,,0,,,0,,,,,
6117571,Scrumban: Essays on Kanban Systems for Lean Software Development,Corey Ladas,"Ladas, Corey",,"=""0578002140""","=""9780578002149""",3,3.69,Modus Cooperandi Press,,178,2008,2008,,2009/11/09,,,read,,,,1,,,0,,,,,
13013633,Incognito: The Secret Lives of the Brain,David Eagleman,"Eagleman, David",,"=""1847679404""","=""9781847679406""",4,4.07,Canongate Books,Paperback,290,2012,2011,2012/05/24,2012/05/03,,,read,Full with fascinating examples of how our brains work and with interesting ideas on how we should interpret and stand with that knowledge. ,,,1,,,1,,,Brand new,,
13493815,Liftoff: Launching Agile Teams & Projects,Diana Larsen,"Larsen, Diana",Ainsley Nies,"=""097792016X""","=""9780977920167""",3,3.77,Onyx Neon Press,Paperback,179,2011,2011,2012/05/15,2012/04/03,,,read,"I see the value of this book not in reading it - I found it almost a bit of a struggle to actually dry-read it. It's real value is in doing a lift-offs, in chartering with your teams and there are great, clear, concise instructions in the book how to achieve that - so just pick the book and take a team through it.",,,1,,,0,,,,,
12924218,Brilliant Mistakes,Paul J.H. Schoemaker,"Schoemaker, Paul J.H.",,"=""1613630123""","=""9781613630129""",3,3.71,Wharton Digital Press,Paperback,190,2011,2011,2012/03/30,2012/03/23,,,read,"When I started reading it I thought I made a wrong choice picking this book or that I will totally disagree with it, I still think it's too focused on the word mistake/error but I actually like the content.",,,1,,,1,,,Brand new,,
13416706,Why Plans Fail: Cognitive Bias & Decision Making,Jim  Benson,"Benson, Jim",,"=""""","=""""",3,3.96,Modus Cooperandi Press,Kindle Edition,60,2011,2011,2012/03/01,2012/01/26,,,read,,,,1,,,1,2012/01/01,,unspecified,,
4477,Complications: A Surgeon's Notes on an Imperfect Science,Atul Gawande,"Gawande, Atul",Susanne Kuhlmann-Krieg,"=""0312421702""","=""9780312421700""",0,4.26,Picador USA,Paperback,270,2003,2002,,2012/03/23,to-read,to-read (#9),to-read,,,,0,,,0,,,,,
2497349,Key Management Models: Key Management Models,Steven Ten Have,"Have, Steven Ten","Wouter ten Have, Frans Stevens, Marcel Van Der Elst, Fiona Pol-Coyne","=""0273662015""","=""9780273662013""",0,3.50,FT Press,Paperback,240,2002,1999,,2010/04/15,,,read,,,,1,,,0,,,,,
21314,The Starfish and the Spider: The Unstoppable Power of Leaderless Organizations,Ori Brafman,"Brafman, Ori",Rod A. Beckstrom,"=""1591841437""","=""9781591841432""",0,3.81,Portfolio,Hardcover,230,2006,2006,,2012/03/22,to-read,to-read (#62),to-read,,,,0,,,0,,,,,
61610,Introducing Neuro-Linguistic Programming: Psychological Skills for Understanding and Influencing People,Joseph  O'Connor,"O'Connor, Joseph",John  Seymour,"=""1855383446""","=""9781855383449""",0,3.74,Harper Element ,Paperback,246,2002,1990,,2009/11/09,to-read,to-read (#63),to-read,,,,0,,,0,,,,,
41786,Joel on Software,Joel Spolsky,"Spolsky, Joel",,"=""1590593898""","=""9781590593899""",0,4.12,Apress,Paperback,384,2004,2004,,2009/11/09,to-read,to-read (#61),to-read,,,,0,,,0,,,,,
7550733,Notes on Nursing,Florence Nightingale,"Nightingale, Florence",,"=""1435100425""","=""9781602069237""",3,3.79,Cosimo Classics,Hardcover,144,2007,1858,2012/03/22,2012/03/07,,,read,"Amazing, so many years later and this book is still current and have some advice that many could do applying today. Also an interesting view into the Victorian England.",,,1,,,1,,,unspecified,,
7796228,The Checklist Manifesto: How to Get Things Right,Atul Gawande,"Gawande, Atul",,"=""""","=""""",4,4.03,,Kindle Edition,225,2009,2009,2012/03/12,2012/03/08,,,read,"Loved the stories, like the ideas and I agree that checklists are underused.",,,1,,,0,,,,,
1108333,"The Puritan Gift: Triumph, Collapse and Revival of an American Dream",Kenneth Hopper,"Hopper, Kenneth",William Hopper,"=""1850434190""","=""9781850434191""",4,4.31,I. B. Tauris,Hardcover,352,2007,2007,2012/03/08,2012/03/05,,,read,"Certainly worth a read. A well written history of the American corporations since the days first settlers set foot on the new land. Gives context to better understand the ups and downs of the US economy, the different management schools of thought and their effect on corporations. Read where people like Sloan, Drucker, Deming, Taylor, Duran, Wren, Given, Sarasohn, Protzman and Polkinghorn among many others worked and what their ideas and contributions really were. Check what effect the American influence had on Japan and the appearance of Lean and TPS for example. Finally, see the 25 principles that every business today would do well to consider in their function.",,Paul DD loves this book.,1,,,1,,,Brand new,,
6588294,Java: A Beginner's Guide,Herbert Schildt,"Schildt, Herbert",,"=""""","=""""",3,3.99,,Kindle Edition,696,,2005,2005/01/01,2010/05/04,,,read,,,,1,,,1,,,Brand new,,
665153,Waltzing with Bears: Managing Risk on Software Projects,Tom DeMarco,"DeMarco, Tom",Timothy R. Lister,"=""0932633609""","=""9780932633606""",5,3.97,"Dorset House Publishing Company, Incorporated",Paperback,196,2003,2003,2012/02/17,2012/02/13,,,read,Wow! This book talks so perfectly well about risk and uncertainty and exposes why we don't do it on IT projects and what are the repercussions. DeMarco and Lister really understand how and why agile works and this was in 2003. Most organisation as still way behind their thinking.,,,1,,,0,,,,,
